<?xml version="1.0" encoding="UTF-8" standalone="no"?>
<TouristVouchers xmlns:xsi="http://www.w3.org/2001/XMLSchema-instance" xsi:schemaLocation="http://www.karach.com/tourist-voucher TouristVoucher.xsd" xmlns="http://www.karach.com/tourist-voucher">
    <TouristVoucher currency="EUR" id="22">
        <Type>VACATION</Type>
        <Country>Spain</Country>
        <MinDays>7</MinDays>
        <MaxDays>8</MaxDays>
        <Transport>PLANE</Transport>
        <HotelCharacteristics>
            <Stars>FIVE</Stars>
            <Food>AL</Food>
            <RoomType>DOUBLE</RoomType>
            <Amenities>included</Amenities>
        </HotelCharacteristics>
        <Cost>5000.0</Cost>
        <StartDate>2023-12-02T20:55:13.543369300Z</StartDate>
    </TouristVoucher>
    <TouristVoucher currency="EUR" id="839">
        <Type>EXCURSION</Type>
        <Country>Poland</Country>
        <MinDays>2</MinDays>
        <MaxDays>3</MaxDays>
        <Transport>BUS</Transport>
        <HotelCharacteristics>
            <Stars>TWO</Stars>
            <Food>BB</Food>
            <RoomType>SINGLE</RoomType>
            <Amenities>included</Amenities>
        </HotelCharacteristics>
        <Cost>500.0</Cost>
        <StartDate>2023-12-02T20:55:13.553341900Z</StartDate>
    </TouristVoucher>
    <TouristVoucher currency="USD" id="313">
        <Type>WEEKEND</Type>
        <Country>Spain</Country>
        <MinDays>7</MinDays>
        <MaxDays>14</MaxDays>
        <Transport>PLANE</Transport>
        <HotelCharacteristics>
            <Stars>FOUR</Stars>
            <Food>HB</Food>
            <RoomType>TRIPLE</RoomType>
            <Amenities>included</Amenities>
        </HotelCharacteristics>
        <Cost>3000.0</Cost>
        <StartDate>2023-12-02T20:55:13.553341900Z</StartDate>
    </TouristVoucher>
    <TouristVoucher currency="ILS" id="767">
        <Type>PILGRIMAGE</Type>
        <Country>Israel</Country>
        <MinDays>14</MinDays>
        <MaxDays>21</MaxDays>
        <Transport>BOAT</Transport>
        <HotelCharacteristics>
            <Stars>THREE</Stars>
            <Food>BB</Food>
            <RoomType>QUAD</RoomType>
            <Amenities>included</Amenities>
        </HotelCharacteristics>
        <Cost>10000.0</Cost>
        <StartDate>2023-12-02T20:55:13.553341900Z</StartDate>
    </TouristVoucher>
</TouristVouchers>
